{
  "schemaVersion": 1,
  "date": "2026-10-06",
  "title": "AI 产品走向日常：入口、溯源与基础设施",
  "summary": "OpenAI 公布欧盟文本水印安排和 ChatGPT 广告新格式；Cloudflare 汇总 Agent 基础设施更新。Builder 继续讨论简单入口、人的沟通、企业部署与持久 Agent。",
  "heroLabel": "AI 日报 · 10月6日",
  "tags": ["文本溯源", "Agent 工作流", "产品入口", "GitHub Trending"],
  "stats": [{"num": 7, "label": "Builder 动态"}, {"num": 5, "label": "今日上榜项目"}, {"num": 3, "label": "官方资料"}, {"num": 1, "label": "公开视频"}],
  "sections": [
    {
      "kind": "analysis", "layout": "highlights", "label": "今日要点", "title": "今日要点",
      "items": [
        {"title": "文本水印开始走向有限部署", "summary": "OpenAI 10 月 5 日说明：全球 API 客户可为部分模型主动开启文本水印，默认关闭；未来数周才会向欧盟符合条件的 ChatGPT 与 Codex 文本输出加入不可见水印。检测器初期仅向获批研究者和专业机构开放，水印也不能证明文本真实或界定责任。", "links": [{"label": "阅读官方说明 →", "url": "https://openai.com/index/eu-text-provenance/"}]},
        {"title": "AI 入口的信任与变现同时被重做", "summary": "OpenAI 宣布将在本月晚些时候先于美国图像生成场景测试清晰标记的新广告格式，并扩展效果衡量。Cloudflare 的一周回顾则汇总了 Agent 沙箱、内容付费和企业工作区等发布。两者分别处理消费端发现与基础设施侧的访问、计费问题。", "links": [{"label": "OpenAI 原文 →", "url": "https://openai.com/index/new-chatgpt-ads-format-and-measurement/"}, {"label": "Cloudflare 原文 →", "url": "https://blog.cloudflare.com/birthday-week-2026-wrap-up/"}]}
      ]
    },
    {
      "kind": "podcasts", "layout": "embed", "label": "深度对话", "title": "No Priors：收购成熟企业后如何推进 AI 改造",
      "intro": "No Priors 9 月 24 日发布的访谈中，Sequence Holdings 联合创始人 Michael Lee 与 Sarah Guo 讨论持有成熟企业并在内部建立工程能力的路径。这是延伸阅读；以下均为受访者的策略判断，不代表改造效果已获独立验证。",
      "embedUrl": "https://www.youtube-nocookie.com/embed/TCpRwJBQvW0",
      "items": [
        {"title": "从企业既有优势出发", "summary": "Lee 认为在品牌、规模或监管形成壁垒的行业，可以通过收购成熟企业并重做技术和组织来争取领先，而不是只向其出售软件。"},
        {"title": "工程师需要进入经营核心", "summary": "他主张让工程团队成为企业文化中受重视的角色，并把技术改造嵌进日常运营，而非把 AI 当成单独采购项目。"},
        {"title": "资本期限要匹配组织改造", "summary": "Sequence 采用长期持有的结构；Lee 称团队希望有足够时间逐步改变流程与产品。访谈中的交易规模和收益预期均应以正式披露为准。", "links": [{"label": "观看原视频 →", "url": "https://www.youtube.com/watch?v=TCpRwJBQvW0"}]}
      ]
    },
    {
      "kind": "news", "layout": "rss", "label": "资讯精选", "title": "官方发布与资料",
      "items": [
        {"title": "OpenAI｜文本水印的适用范围与局限", "summary": "官方称欧盟 ChatGPT 与 Codex 的符合条件文本将在未来数周加入水印；全球 API 用户已可为部分模型选择开启。OpenAI 自测显示，短文本和经改写文本更难检测，因此检测结果只能作为有限线索。", "source": "OpenAI 官方博客", "publishedAt": "2026-10-05", "links": [{"label": "阅读原文 →", "url": "https://openai.com/index/eu-text-provenance/"}]},
        {"title": "OpenAI｜图像生成中的广告试验", "summary": "新视觉广告格式将于本月晚些时候先向美国一组广告主开放测试，广告会标记并与生成图像分开。公司同时介绍转化归因与品牌适宜性评估合作；文中案例数据来自合作方。", "source": "OpenAI 官方博客", "publishedAt": "2026-10-05", "links": [{"label": "阅读原文 →", "url": "https://openai.com/index/new-chatgpt-ads-format-and-measurement/"}]},
        {"title": "Cloudflare｜一周 46 项发布的 Agent 线索", "summary": "10 月 5 日官方回顾汇总了 46 项上周公告，包括用于 Agent 的容器沙箱、内容按次付费、模型自动路由，以及开放候补名单的企业 Agent 工作区；各项可用状态需以对应产品公告为准。", "source": "Cloudflare 官方博客", "publishedAt": "2026-10-05", "links": [{"label": "阅读回顾 →", "url": "https://blog.cloudflare.com/birthday-week-2026-wrap-up/"}]}
      ]
    },
    {
      "kind": "builders", "layout": "vitem", "label": "Builder 动态", "title": "一线实践与判断",
      "items": [
        {"title": "Thibault Sottiaux｜承诺连续改进产品体验", "summary": "负责 Codex 与 ChatGPT 的 Sottiaux 表示，接下来 28 天每天将推出一项对多数 Codex 或 Work 用户有明显价值的改进，或提供一次完整重置。这是未来安排，不等于各项改进已经上线。", "links": [{"label": "查看原帖 →", "url": "https://x.com/thsottiaux/status/2106845241357824205"}]},
        {"title": "Peter Yang｜让用户在既有工具中使用 Granola", "summary": "Yang 分享对 Granola 联合创始人 Sam 的访谈：企业会在内部工具中通过 MCP 使用会议上下文，产品团队需要接受一部分价值在自身界面之外发生。此处是受访者的产品经验。", "links": [{"label": "查看访谈片段 →", "url": "https://x.com/petergyang/status/2106897211766530299"}], "media": [{"src": "assets/2026-10-06/petergyang-2106897211766530299-0.jpg", "width": 800, "height": 450, "alt": "Peter Yang 原帖视频中的 Granola 演示画面"}]},
        {"title": "Guillermo Rauch｜文档按读者区分", "summary": "Rauch 分享自己的写作原则：README 面向人，应亲自写清故事；供 Agent 使用的内部说明可以用更结构化的机器友好语言。他另称 Vercel 从 Go 迁移 Turborepo 到 Rust 时，人力迁移成本曾是重要争议。", "links": [{"label": "文档原帖 →", "url": "https://x.com/rauchg/status/2106848085267902815"}, {"label": "Rust 迁移原帖 →", "url": "https://x.com/rauchg/status/2106863842450133114"}]},
        {"title": "Aaron Levie｜企业部署催生新岗位", "summary": "Box CEO Levie 观察到应用 AI 工程师、驻场工程师和部署服务等岗位需求，也认为既有数据、研究及软件岗位正在转向 AI 工作。这是他对就业结构的判断，未在此给出可独立验证的总量。", "links": [{"label": "查看原帖 →", "url": "https://x.com/levie/status/2106893015063421357"}]},
        {"title": "Ryo Lu｜展示口袋里的桌面界面", "summary": "Ryo Lu 发布一段界面演示，展示全屏桌面与侧边 Dock 在手机形态中的组合。帖子展示的是设计迭代，没有说明公开发布时间或产品可用范围。", "links": [{"label": "查看演示原帖 →", "url": "https://x.com/ryolu_/status/2106777615801713054"}], "media": [{"src": "assets/2026-10-06/ryolu_-2106777615801713054-0.jpg", "width": 800, "height": 540, "alt": "Ryo Lu 原帖视频中的手机桌面界面"}]},
        {"title": "Dan Shipper｜持续 Agent 会成为主要入口吗", "summary": "Every CEO Shipper 说，近几周 dot 成为他使用 AI 的主要入口。他预测持续在线的 Agent 交互会保留，而当前角色化外观可能淡出；后半部分只是个人预测。", "links": [{"label": "查看原帖 →", "url": "https://x.com/danshipper/status/2106892868564431255"}]},
        {"title": "Matt Turck｜可解释性仍是基础问题", "summary": "Turck 分享 Goodfire 研究者 Eric Ho 的访谈片段，强调模型并非按传统软件方式逐条构建，对内部机理的理解仍有限，因此需要更好的可解释性研究。", "links": [{"label": "查看原帖与片段 →", "url": "https://x.com/mattturck/status/2106821381765956044"}]}
      ]
    },
    {
      "kind": "github", "layout": "card", "label": "GitHub Trending", "title": "今日上榜项目",
      "footnote": "根据 10 月 6 日 GitHub Trending 实时榜单整理；星标和分叉来自本次 GitHub API 快照，数值与榜单随时变化。",
      "items": [
        {"title": "thedotmack/claude-mem", "summary": "为多种编码 Agent 捕获、压缩并在后续会话注入相关上下文的持久记忆工具。", "url": "https://github.com/thedotmack/claude-mem", "owner": "thedotmack", "repoName": "claude-mem", "avatar": "https://github.com/thedotmack.png", "stars": 96651, "forks": 8526, "language": "TypeScript", "topics": ["ai-memory", "claude-code"]},
        {"title": "pingdotgg/t3code", "summary": "用于控制本机编码 Agent 的界面，项目 README 介绍了移动端、网页和桌面客户端及所支持的工具。", "url": "https://github.com/pingdotgg/t3code", "owner": "pingdotgg", "repoName": "t3code", "avatar": "https://github.com/pingdotgg.png", "stars": 25635, "forks": 6598, "language": "TypeScript", "topics": []},
        {"title": "Panniantong/Agent-Reach", "summary": "为 Agent 提供跨社交平台与视频站点读取、搜索能力的命令行工具；免费和覆盖范围是项目方描述。", "url": "https://github.com/Panniantong/Agent-Reach", "owner": "Panniantong", "repoName": "Agent-Reach", "avatar": "https://github.com/Panniantong.png", "stars": 91921, "forks": 8067, "language": "Python", "topics": ["ai-agent", "cli"]},
        {"title": "calesthio/OpenMontage", "summary": "将视频制作流程、工具和 Agent 技能集中到开源项目中的制作系统；具体规模以仓库说明为准。", "url": "https://github.com/calesthio/OpenMontage", "owner": "calesthio", "repoName": "OpenMontage", "avatar": "https://github.com/calesthio.png", "stars": 64075, "forks": 8131, "language": "Python", "topics": ["video-production", "agent"]},
        {"title": "cloudflare/cloudflare-os", "summary": "基于 Cloudflare Workers 的 Agent 工作区，用于连接企业上下文并创建文档或应用；托管部署仍需看官方候补安排。", "url": "https://github.com/cloudflare/cloudflare-os", "owner": "cloudflare", "repoName": "cloudflare-os", "avatar": "https://github.com/cloudflare.png", "stars": 11024, "forks": 1310, "language": "TypeScript", "topics": []}
      ]
    },
    {
      "kind": "analysis", "layout": "prose", "label": "今日思考", "title": "把可用性和可核验性一起设计",
      "intro": "今天的官方公告和 Builder 原帖从不同层面指向同一件事：用户需要更少的入口负担，也需要知道内容从何而来、系统做了什么。文本水印能提供部分来源线索，但不能代替事实核查；持续 Agent 和企业工作区可以减少切换，也必须明确权限与责任。<br><strong>今日一问：</strong>如果你的产品把更多工作交给持续运行的 Agent，用户应在哪些节点看见来源、确认动作并保留退出权？",
      "items": [{"title": "今日一问", "summary": "如果你的产品把更多工作交给持续运行的 Agent，用户应在哪些节点看见来源、确认动作并保留退出权？"}]
    }
  ],
  "sources": [
    {"title": "OpenAI｜欧盟文本溯源规则说明", "url": "https://openai.com/index/eu-text-provenance/"},
    {"title": "OpenAI｜ChatGPT 广告新格式", "url": "https://openai.com/index/new-chatgpt-ads-format-and-measurement/"},
    {"title": "Cloudflare｜2026 Birthday Week 回顾", "url": "https://blog.cloudflare.com/birthday-week-2026-wrap-up/"},
    {"title": "No Priors｜Michael Lee 原视频", "url": "https://www.youtube.com/watch?v=TCpRwJBQvW0"},
    {"title": "Thibault Sottiaux｜28 天改进安排", "url": "https://x.com/thsottiaux/status/2106845241357824205"},
    {"title": "Peter Yang｜Granola 访谈片段", "url": "https://x.com/petergyang/status/2106897211766530299"},
    {"title": "Guillermo Rauch｜文档写作原则", "url": "https://x.com/rauchg/status/2106848085267902815"},
    {"title": "Guillermo Rauch｜Rust 迁移观察", "url": "https://x.com/rauchg/status/2106863842450133114"},
    {"title": "Aaron Levie｜企业 AI 岗位", "url": "https://x.com/levie/status/2106893015063421357"},
    {"title": "Ryo Lu｜界面演示", "url": "https://x.com/ryolu_/status/2106777615801713054"},
    {"title": "Dan Shipper｜持续 Agent 入口", "url": "https://x.com/danshipper/status/2106892868564431255"},
    {"title": "Matt Turck｜可解释性访谈片段", "url": "https://x.com/mattturck/status/2106821381765956044"},
    {"title": "GitHub｜10 月 6 日 Trending", "url": "https://github.com/trending?since=daily"},
    {"title": "thedotmack/claude-mem", "url": "https://github.com/thedotmack/claude-mem"},
    {"title": "pingdotgg/t3code", "url": "https://github.com/pingdotgg/t3code"},
    {"title": "Panniantong/Agent-Reach", "url": "https://github.com/Panniantong/Agent-Reach"},
    {"title": "calesthio/OpenMontage", "url": "https://github.com/calesthio/OpenMontage"},
    {"title": "cloudflare/cloudflare-os", "url": "https://github.com/cloudflare/cloudflare-os"}
  ]
}
