{
  "schemaVersion": 1,
  "date": "2026-10-23",
  "title": "从主动代理到即时决策：AI 产品进入工作流",
  "summary": "Anthropic 的 Claude Duet 开放候补研究预览，OpenAI 将 Decisions API 推向正式可用；Every 的团队访谈把持续试验、评估与产品化串成一条线。Builder 关注企业安全、模型路由和新工具的实际采用。",
  "heroLabel": "AI 日报 · 10月23日",
  "tags": [
    "主动代理",
    "即时决策",
    "企业落地",
    "安全评估"
  ],
  "stats": [
    {
      "num": 4,
      "label": "Builder 动态"
    },
    {
      "num": 3,
      "label": "今日上榜项目"
    },
    {
      "num": 2,
      "label": "产品发布"
    },
    {
      "num": 1,
      "label": "公开视频"
    }
  ],
  "sections": [
    {
      "kind": "analysis",
      "layout": "highlights",
      "label": "今日要点",
      "title": "让 AI 从回答问题走向持续行动",
      "items": [
        {
          "title": "Claude Duet 开放研究预览",
          "summary": "<strong>主动整理待办，也会在关键动作前询问</strong><br>Anthropic 10 月 21 日开放 Claude Duet 候补名单，面向美国 Pro 与 Max 用户。它在独立应用中根据已连接应用提供晨间简报、跟踪待办并继续处理任务；这仍是研究预览，使用量与 Claude 方案共享。",
          "links": [
            {
              "label": "阅读 Anthropic 原文 →",
              "url": "https://claude.com/resources/articles/claude-duet"
            }
          ]
        },
        {
          "title": "Decisions API 正式可用",
          "summary": "<strong>给有限答案问题一条更短的调用路径</strong><br>OpenAI 10 月 22 日宣布 Decisions API 正式可用，基于 GPT‑6 Luna，返回概率、选项或分数。官方称在其比较条件下可比经 Responses API 调用 Luna 快至 10 倍；具体延迟仍须在真实负载中测量。",
          "links": [
            {
              "label": "阅读 OpenAI 原文 →",
              "url": "https://openai.com/index/decisions-api/"
            }
          ]
        }
      ]
    },
    {
      "kind": "podcasts",
      "layout": "embed",
      "label": "深度对话",
      "title": "Every：企业怎样设立前沿试验团队",
      "intro": "Every 原频道 10 月 21 日节目讨论，小团队如何持续试新模型，又不让所有员工陷入追逐工具的循环。以下是受访团队自身的实践经验。",
      "embedUrl": "https://www.youtube-nocookie.com/embed/LZbjIE2LeTQ",
      "items": [
        {
          "title": "试验者与工程化者配对",
          "summary": "团队用“海盗”和“建筑师”区分快速探索与把有效原型整理成可维护系统的工作；实验先证明价值，再进入产品或服务。"
        },
        {
          "title": "建立个人化评估",
          "summary": "负责评估的成员提议把“模型太迎合用户”等主观感受写成可反复检查的测试，并让团队成员参与基准建设。"
        },
        {
          "title": "原型要解决具体工作问题",
          "summary": "节目展示了减少标签页分心的浏览器、理解读者的写作插件和名为 Minga 的任务编排器；这些是团队展示的探索项目，并非普遍适用的生产方案。",
          "links": [
            {
              "label": "观看 Every 原频道节目 →",
              "url": "https://www.youtube.com/watch?v=LZbjIE2LeTQ"
            }
          ]
        }
      ]
    },
    {
      "kind": "news",
      "layout": "rss",
      "label": "资讯精选",
      "title": "官方发布与延伸阅读",
      "items": [
        {
          "title": "OpenAI｜Decisions API 的输入与答案类型",
          "summary": "开发者可提供文本、图片或原生 JSON，一次请求最多询问 400 个有限答案问题；官方列出概率、选项和分数三种结果类型。",
          "source": "OpenAI",
          "publishedAt": "2026-10-22",
          "links": [
            {
              "label": "阅读产品公告 →",
              "url": "https://openai.com/index/decisions-api/"
            }
          ]
        },
        {
          "title": "Anthropic｜Claude Duet 的预览范围",
          "summary": "Duet 首先向美国 Pro 与 Max 用户开放候补研究预览，支持 iOS、Android 与网页。公告提醒它仍可能误判优先级，重要行动会先征询用户。",
          "source": "Anthropic",
          "publishedAt": "2026-10-21",
          "links": [
            {
              "label": "阅读发布说明 →",
              "url": "https://claude.com/resources/articles/claude-duet"
            }
          ]
        },
        {
          "title": "OpenAI｜FDE 团队如何缩小部署落差",
          "summary": "OpenAI 前线部署工程团队说明，先与客户一起定义可评估的结果，再把有效的定制工作沉淀为可复用的产品能力。文中的客户成果属于公司案例。",
          "source": "OpenAI",
          "publishedAt": "2026-10-22",
          "links": [
            {
              "label": "阅读工程文章 →",
              "url": "https://openai.com/index/forward-deployed-engineering-means/"
            }
          ]
        }
      ]
    },
    {
      "kind": "builders",
      "layout": "vitem",
      "label": "Builder 动态",
      "title": "把新能力放回真实工作里",
      "items": [
        {
          "title": "Cat Wu｜Duet 希望主动接手工作",
          "summary": "Anthropic 的 Cat Wu 说，团队听到用户希望 Claude 更主动，因此让 Duet 发现待办并在用户提出要求前推进。具体可用范围仍以官方研究预览说明为准。",
          "links": [
            {
              "label": "查看原帖 →",
              "url": "https://x.com/_catwu/status/2112988751576330487"
            }
          ]
        },
        {
          "title": "Dan Shipper｜前沿团队分担试验成本",
          "summary": "Every 的 Dan Shipper 认为，跟进模型变化需要专门小组；其他同事可以采用验证过的发现。他的帖子列出了节目讨论的评估、写作工具与编排原型。",
          "media": [
            {
              "src": "assets/2026-10-23/danshipper-2113010761786175970-0.jpg",
              "width": 800,
              "height": 450,
              "alt": "Dan Shipper 原帖视频中的 Every 节目画面"
            }
          ],
          "links": [
            {
              "label": "查看原帖 →",
              "url": "https://x.com/danshipper/status/2113010761786175970"
            }
          ]
        },
        {
          "title": "Aaron Levie｜安全工作仍需要人来把关",
          "summary": "Box 的 Aaron Levie 认为，Agent 会加快查找、修补与攻击漏洞的速度，但企业仍需人员确定优先级、复核发现、修复并响应事件。这是他的行业判断。",
          "links": [
            {
              "label": "查看原帖 →",
              "url": "https://x.com/levie/status/2113137032633757773"
            }
          ]
        },
        {
          "title": "Guillermo Rauch｜小模型加入 Token Pass",
          "summary": "Vercel 的 Guillermo Rauch 称 DeepSeek V4.1 Flash 已加入 Token Pass，适合承担大模型规划后的子任务。低成本和速度是他的产品评价，实际表现需按任务测试。",
          "media": [
            {
              "src": "assets/2026-10-23/rauchg-2113010010766913815-1.jpg",
              "width": 800,
              "height": 419,
              "alt": "Guillermo Rauch 原帖引用视频中展示的 Token Pass 模型列表"
            }
          ],
          "links": [
            {
              "label": "查看原帖 →",
              "url": "https://x.com/rauchg/status/2113010010766913815"
            }
          ]
        }
      ]
    },
    {
      "kind": "github",
      "layout": "card",
      "label": "GitHub Trending",
      "title": "今日榜单的三个工具",
      "footnote": "按 10 月 23 日 GitHub Trending 实时榜单筛选，避开昨日重点；星标、分叉与语言是本次 GitHub API 快照，随后会变化。用途按仓库自述整理。",
      "items": [
        {
          "title": "anthropics/knowledge-work-plugins",
          "summary": "面向知识工作者的 Claude Cowork 插件开源库；使用前应检查插件权限与适用流程。",
          "url": "https://github.com/anthropics/knowledge-work-plugins",
          "owner": "anthropics",
          "repoName": "knowledge-work-plugins",
          "avatar": "https://github.com/anthropics.png",
          "stars": 31655,
          "forks": 3536,
          "language": "Python",
          "topics": []
        },
        {
          "title": "cloudflare/security-audit-skill",
          "summary": "面向编码 Agent 的多阶段安全审计 skill，强调独立核验与机器可读的发现记录。",
          "url": "https://github.com/cloudflare/security-audit-skill",
          "owner": "cloudflare",
          "repoName": "security-audit-skill",
          "avatar": "https://github.com/cloudflare.png",
          "stars": 39681,
          "forks": 2477,
          "language": "JavaScript",
          "topics": []
        },
        {
          "title": "Graphify-Labs/graphify",
          "summary": "把代码、文档和配置解析为可查询知识图谱；仓库强调本地确定性 AST 解析。",
          "url": "https://github.com/Graphify-Labs/graphify",
          "owner": "Graphify-Labs",
          "repoName": "graphify",
          "avatar": "https://github.com/Graphify-Labs.png",
          "stars": 133025,
          "forks": 12728,
          "language": "Python",
          "topics": [
            "knowledge-graph",
            "code-analysis"
          ]
        }
      ]
    },
    {
      "kind": "analysis",
      "layout": "prose",
      "label": "今日思考",
      "title": "把主动性与可验证性一起设计",
      "intro": "主动代理会自己发现任务，即时决策接口会更快地完成高频分类；两者都把“什么时候行动、何时交给人、如何复核”推到产品设计前面。Every 的前沿团队经验则提醒：试验本身需要清晰的评估与沉淀路径。<br><strong>今日一问：</strong>你的产品里哪一个高频决定可以先限定答案范围，并记录人工复核结果？",
      "items": [
        {
          "title": "今日一问",
          "summary": "挑一个可反复测量的决策，明确答案集合、升级条件和复核人。"
        }
      ]
    }
  ],
  "sources": [
    {
      "title": "Anthropic｜Claude Duet 官方公告",
      "url": "https://claude.com/resources/articles/claude-duet"
    },
    {
      "title": "OpenAI｜Decisions API 官方公告",
      "url": "https://openai.com/index/decisions-api/"
    },
    {
      "title": "OpenAI｜前线部署工程团队文章",
      "url": "https://openai.com/index/forward-deployed-engineering-means/"
    },
    {
      "title": "Every｜前沿团队原频道视频",
      "url": "https://www.youtube.com/watch?v=LZbjIE2LeTQ"
    },
    {
      "title": "Every｜节目逐字内容",
      "url": "https://share.snipd.com/episode/e7f196d8-ed87-4cb5-a473-b056911f47b9"
    },
    {
      "title": "Cat Wu｜Duet 原帖",
      "url": "https://x.com/_catwu/status/2112988751576330487"
    },
    {
      "title": "Dan Shipper｜前沿团队原帖",
      "url": "https://x.com/danshipper/status/2113010761786175970"
    },
    {
      "title": "Aaron Levie｜安全工作原帖",
      "url": "https://x.com/levie/status/2113137032633757773"
    },
    {
      "title": "Guillermo Rauch｜Token Pass 原帖",
      "url": "https://x.com/rauchg/status/2113010010766913815"
    },
    {
      "title": "GitHub｜10 月 23 日 Trending",
      "url": "https://github.com/trending"
    },
    {
      "title": "anthropics/knowledge-work-plugins",
      "url": "https://github.com/anthropics/knowledge-work-plugins"
    },
    {
      "title": "cloudflare/security-audit-skill",
      "url": "https://github.com/cloudflare/security-audit-skill"
    },
    {
      "title": "Graphify-Labs/graphify",
      "url": "https://github.com/Graphify-Labs/graphify"
    }
  ]
}
